<?xml version="1.0" encoding="UTF-8" standalone="no" ?>
<root xmlns:xsi="http://www.w3.org/2001/XMLSchema-instance" xsi:noNamespaceSchemaLocation="syntax_10.xsd">

  <version>1</version>

  <page>
    <name>General</name>
    <group>
      <name>MAIN</name>
      <field>
        <name>CONTRAST</name>
        <sign>unsigned</sign>
        <base>hex</base>
        <value>88</value>
        <data>
          <type>53_direct</type>
          <addr1>0</addr1>
          <addr2>20027838</addr2>
          <upper>7</upper>
          <lower>0</lower>
        </data>
        <description></description>
        <ro>0</ro>
      </field>
      <field>
        <name>CONTRAST_HIBYTE</name>
        <sign>unsigned</sign>
        <base>hex</base>
        <value>0</value>
        <data>
          <type>53_direct</type>
          <addr1>0</addr1>
          <addr2>20027838</addr2>
          <upper>9</upper>
          <lower>8</lower>
        </data>
        <description></description>
        <ro>0</ro>
      </field>
      <field>
        <name>BRIGHTNESS</name>
        <sign>unsigned</sign>
        <base>hex</base>
        <value>7A</value>
        <data>
          <type>53_direct</type>
          <addr1>0</addr1>
          <addr2>20027838</addr2>
          <upper>26</upper>
          <lower>19</lower>
        </data>
        <description></description>
        <ro>0</ro>
      </field>
      <field>
        <name>SATURATION</name>
        <sign>unsigned</sign>
        <base>hex</base>
        <value>B0</value>
        <data>
          <type>53_direct</type>
          <addr1>0</addr1>
          <addr2>2002783c</addr2>
          <upper>7</upper>
          <lower>0</lower>
        </data>
        <description></description>
        <ro>0</ro>
      </field>
      <field>
        <name>SATURATION_HIBYTE</name>
        <sign>unsigned</sign>
        <base>hex</base>
        <value>0</value>
        <data>
          <type>53_direct</type>
          <addr1>0</addr1>
          <addr2>2002783c</addr2>
          <upper>9</upper>
          <lower>8</lower>
        </data>
        <description></description>
        <ro>0</ro>
      </field>
      <field>
        <name>HUE</name>
        <sign>unsigned</sign>
        <base>hex</base>
        <value>80</value>
        <data>
          <type>53_direct</type>
          <addr1>0</addr1>
          <addr2>2002783c</addr2>
          <upper>25</upper>
          <lower>18</lower>
        </data>
        <description></description>
        <ro>0</ro>
      </field>
    </group>
  </page>

  <page>
    <name>SHARP1</name>
    <group>
      <name>GAIN</name>
      <field>
        <name>LOW</name>
        <sign>unsigned</sign>
        <base>hex</base>
        <value>50</value>
        <data>
          <type>53_direct</type>
          <addr1>0</addr1>
          <addr2>20025340</addr2>
          <upper>7</upper>
          <lower>0</lower>
        </data>
        <description></description>
        <ro>0</ro>
      </field>
      <field>
        <name>LOW_NEG</name>
        <sign>unsigned</sign>
        <base>hex</base>
        <value>50</value>
        <data>
          <type>53_direct</type>
          <addr1>0</addr1>
          <addr2>20025344</addr2>
          <upper>7</upper>
          <lower>0</lower>
        </data>
        <description></description>
        <ro>0</ro>
      </field>
      <field>
        <name>MID</name>
        <sign>unsigned</sign>
        <base>hex</base>
        <value>54</value>
        <data>
          <type>53_direct</type>
          <addr1>0</addr1>
          <addr2>20025340</addr2>
          <upper>15</upper>
          <lower>8</lower>
        </data>
        <description></description>
        <ro>0</ro>
      </field>
      <field>
        <name>MID_NEG</name>
        <sign>unsigned</sign>
        <base>hex</base>
        <value>54</value>
        <data>
          <type>53_direct</type>
          <addr1>0</addr1>
          <addr2>20025344</addr2>
          <upper>15</upper>
          <lower>8</lower>
        </data>
        <description></description>
        <ro>0</ro>
      </field>
      <field>
        <name>HIGH</name>
        <sign>unsigned</sign>
        <base>hex</base>
        <value>5A</value>
        <data>
          <type>53_direct</type>
          <addr1>0</addr1>
          <addr2>20025340</addr2>
          <upper>23</upper>
          <lower>16</lower>
        </data>
        <description></description>
        <ro>0</ro>
      </field>
      <field>
        <name>HIGH_NEG</name>
        <sign>unsigned</sign>
        <base>hex</base>
        <value>5A</value>
        <data>
          <type>53_direct</type>
          <addr1>0</addr1>
          <addr2>20025344</addr2>
          <upper>23</upper>
          <lower>16</lower>
        </data>
        <description></description>
        <ro>0</ro>
      </field>
    </group>
    <group>
      <name>CORING</name>
      <field>
        <name>LOW_CORING</name>
        <sign>unsigned</sign>
        <base>hex</base>
        <value>1</value>
        <data>
          <type>53_direct</type>
          <addr1>0</addr1>
          <addr2>20025348</addr2>
          <upper>7</upper>
          <lower>0</lower>
        </data>
        <description></description>
        <ro>0</ro>
      </field>
      <field>
        <name>MID_CORING</name>
        <sign>unsigned</sign>
        <base>hex</base>
        <value>1</value>
        <data>
          <type>53_direct</type>
          <addr1>0</addr1>
          <addr2>20025348</addr2>
          <upper>15</upper>
          <lower>8</lower>
        </data>
        <description></description>
        <ro>0</ro>
      </field>
      <field>
        <name>HIGH_CORING</name>
        <sign>unsigned</sign>
        <base>hex</base>
        <value>1</value>
        <data>
          <type>53_direct</type>
          <addr1>0</addr1>
          <addr2>20025348</addr2>
          <upper>23</upper>
          <lower>16</lower>
        </data>
        <description></description>
        <ro>0</ro>
      </field>
    </group>
    <group>
      <name>LIMIT</name>
      <field>
        <name>LOW_LIMIT_POS</name>
        <sign>unsigned</sign>
        <base>hex</base>
        <value>FF</value>
        <data>
          <type>53_direct</type>
          <addr1>0</addr1>
          <addr2>2002534c</addr2>
          <upper>7</upper>
          <lower>0</lower>
        </data>
        <description></description>
        <ro>0</ro>
      </field>
      <field>
        <name>LOW_LIMIT_NEG</name>
        <sign>unsigned</sign>
        <base>hex</base>
        <value>FF</value>
        <data>
          <type>53_direct</type>
          <addr1>0</addr1>
          <addr2>20025350</addr2>
          <upper>7</upper>
          <lower>0</lower>
        </data>
        <description></description>
        <ro>0</ro>
      </field>
      <field>
        <name>MID_LIMIT_POS</name>
        <sign>unsigned</sign>
        <base>hex</base>
        <value>FF</value>
        <data>
          <type>53_direct</type>
          <addr1>0</addr1>
          <addr2>2002534c</addr2>
          <upper>15</upper>
          <lower>8</lower>
        </data>
        <description></description>
        <ro>0</ro>
      </field>
      <field>
        <name>MID_LIMIT_NEG</name>
        <sign>unsigned</sign>
        <base>hex</base>
        <value>FF</value>
        <data>
          <type>53_direct</type>
          <addr1>0</addr1>
          <addr2>20025350</addr2>
          <upper>15</upper>
          <lower>8</lower>
        </data>
        <description></description>
        <ro>0</ro>
      </field>
      <field>
        <name>HIGH_LIMIT_POS</name>
        <sign>unsigned</sign>
        <base>hex</base>
        <value>FF</value>
        <data>
          <type>53_direct</type>
          <addr1>0</addr1>
          <addr2>2002534c</addr2>
          <upper>23</upper>
          <lower>16</lower>
        </data>
        <description></description>
        <ro>0</ro>
      </field>
      <field>
        <name>HIGH_LIMIT_NEG</name>
        <sign>unsigned</sign>
        <base>hex</base>
        <value>FF</value>
        <data>
          <type>53_direct</type>
          <addr1>0</addr1>
          <addr2>20025350</addr2>
          <upper>23</upper>
          <lower>16</lower>
        </data>
        <description></description>
        <ro>0</ro>
      </field>
    </group>
    <group>
      <name>CLIP</name>
      <field>
        <name>CLIP_POS_EN</name>
        <sign>unsigned</sign>
        <base>hex</base>
        <value>0</value>
        <data>
          <type>53_direct</type>
          <addr1>0</addr1>
          <addr2>20025354</addr2>
          <upper>31</upper>
          <lower>31</lower>
        </data>
        <description></description>
        <ro>0</ro>
      </field>
      <field>
        <name>CLIP_NEG_EN</name>
        <sign>unsigned</sign>
        <base>hex</base>
        <value>0</value>
        <data>
          <type>53_direct</type>
          <addr1>0</addr1>
          <addr2>20025354</addr2>
          <upper>30</upper>
          <lower>30</lower>
        </data>
        <description></description>
        <ro>0</ro>
      </field>
      <field>
        <name>GB_CLIP_POS_EN_L</name>
        <sign>unsigned</sign>
        <base>hex</base>
        <value>1</value>
        <data>
          <type>53_direct</type>
          <addr1>0</addr1>
          <addr2>20025354</addr2>
          <upper>23</upper>
          <lower>23</lower>
        </data>
        <description></description>
        <ro>0</ro>
      </field>
      <field>
        <name>GB_CLIP_NEG_EN_L</name>
        <sign>unsigned</sign>
        <base>hex</base>
        <value>1</value>
        <data>
          <type>53_direct</type>
          <addr1>0</addr1>
          <addr2>20025354</addr2>
          <upper>22</upper>
          <lower>22</lower>
        </data>
        <description></description>
        <ro>0</ro>
      </field>
      <field>
        <name>GB_CLIP_POS_EN_M</name>